{
  "schemaVersion": "0.1.0",
  "kind": "xedit-audit",
  "id": "io.github.theboyyss.xeditauditexample.xedit_audits",
  "audits": [
    {
      "id": "io.github.theboyyss.xeditauditexample.xedit_audits.record_inspection",
      "summary": "Synthetic record inspection audit evidence for future xEdit adapter support.",
      "intent": "record-inspection",
      "mode": "script-report-evidence",
      "scriptLanguage": "pascal",
      "reportFormat": "json",
      "targetPlugins": [
        {
          "name": "SyntheticAuditSubject.esp",
          "role": "subject"
        }
      ],
      "recordTypes": [
        "QUST",
        "DIAL"
      ],
      "requires": {
        "capabilities": [
          {
            "id": "tool.xedit.record_inspection"
          }
        ]
      },
      "outputs": {
        "script": "generated/xedit-audit/scripts/synthetic-record-inspection.pas",
        "report": "generated/xedit-audit/reports/synthetic-record-inspection.json"
      },
      "safety": {
        "executesXEdit": false,
        "mutatesPlugins": false,
        "writesPatches": false,
        "usesRealPluginFixture": false
      }
    }
  ]
}
